### ISSUE TITLE
LIFX bulbs not being discovered

### ISSUE THREAD

**Issue by JakeHPark** [samclane/mantle#14]
Hi, I'm on NixOS 25.11, and figured I'd try Mantle 0.0.18 (built from source), but it's stalling on:

```
2026-05-03T00:16:54.992251656+10:00 DEBUG mantle::device_manager - Doing discovery
2026-05-03T00:16:54.992351986+10:00 DEBUG mantle::device_manager - Discovering bulbs on LAN 192.168.0.255:56700
```

Nothing else seems out of the ordinary. The bulbs are definitely on the same LAN, and pinging them works fine:

```
PING 192.168.0.62 (192.168.0.62) 56(84) bytes of data.
64 bytes from 192.168.0.62: icmp_seq=1 ttl=255 time=109 ms
```

Here's my `ip addr`:

```
ip addr
1: lo: <LOOPBACK,UP,LOWER_UP> mtu 65536 qdisc noqueue state UNKNOWN group default qlen 1000
    link/loopback 00:00:00:00:00:00 brd 00:00:00:00:00:00
    inet 127.0.0.1/8 scope host lo
       valid_lft forever preferred_lft forever
    inet6 ::1/128 scope host noprefixroute 
       valid_lft forever preferred_lft forever
2: enp37s0: <BROADCAST,MULTICAST,UP,LOWER_UP> mtu 1500 qdisc fq_codel state UP group default qlen 1000
    link/ether 70:85:c2:7c:ec:93 brd ff:ff:ff:ff:ff:ff
    altname enx7085c27cec93
    inet 192.168.0.127/24 brd 192.168.0.255 scope global noprefixroute enp37s0
       valid_lft forever preferred_lft forever
    inet6 2001:8004:1d86:e65a:14ef:3f90:3ac5:935b/64 scope global temporary dynamic 
       valid_lft 86258sec preferred_lft 14258sec
    inet6 2001:8004:1d86:e65a:b7a7:8ea6:1249:18f9/64 scope global dynamic mngtmpaddr noprefixroute 
       valid_lft 86258sec preferred_lft 14258sec
    inet6 fe80::4437:fbf3:3ef4:3bae/64 scope link noprefixroute 
       valid_lft forever preferred_lft forever
```

Moreover, here's `sudo lsof -nP -iUDP:56700`:

```
COMMAND PID USER FD TYPE DEVICE SIZE/OFF NODE NAME
.mantle-w 83496 jakehpark 10u IPv4 1428807 0t0 UDP *:56700
.mantle-w 83496 jakehpark 49u IPv4 1428807 0t0 UDP *:56700
.mantle-w 83496 jakehpark 50u IPv4 1428807 0t0 UDP *:56700
.mantle-w 83496 jakehpark 51u IPv4 1428807 0t0 UDP *:56700
```

And finally, `sudo tcpdump -ni enp37s0 -X udp port 56700 -c 6`:

```
tcpdump: verbose output suppressed, use -v[v]... for full protocol decode
listening on enp37s0, link-type EN10MB (Ethernet), snapshot length 262144 bytes
23:48:50.660532 IP 192.168.0.127.56700 > 192.168.0.255.56700: UDP, length 36
	0x0000:  4500 0040 d049 4000 4011 e794 c0a8 007f  E..@.I@.@.......
	0x0010:  c0a8 00ff dd7c dd7c 002c 830c 2400 0034  .....|.|.,..$..4
	0x0020:  7473 7572 0000 0000 0000 0000 0000 0000  tsur............
	0x0030:  0000 0000 0000 0000 0000 0000 0200 0000  ................
23:48:50.771811 IP 192.168.0.61.56700 > 192.168.0.127.56700: UDP, length 41
	0x0000:  4500 0045 0493 0000 ff11 3508 c0a8 003d  E..E......5....=
	0x0010:  c0a8 007f dd7c dd7c 0031 1510 2900 0014  .....|.|.1..)...
	0x0020:  7473 7572 d073 d56b 4715 0000 4c49 4658  tsur.s.kG...LIFX
	0x0030:  5632 0000 38a2 a58e 0505 0000 0300 0000  V2..8...........
	0x0040:  017c dd00 00                             .|...
23:48:50.771926 IP 192.168.0.62.56700 > 192.168.0.127.56700: UDP, length 41
	0x0000:  4500 0045 0487 0000 ff11 3513 c0a8 003e  E..E......5....>
	0x0010:  c0a8 007f dd7c dd7c 0031 17cf 2900 0014  .....|.|.1..)...
	0x0020:  7473 7572 d073 d56b a201 0000 4c49 4658  tsur.s.k....LIFX
	0x0030:  5632 0000 78f9 078b 0505 0000 0300 0000  V2..x...........
	0x0040:  017c dd00 00                             .|...
23:48:50.773583 IP 192.168.0.2.56700 > 192.168.0.127.56700: UDP, length 41
	0x0000:  4500 0045 26ed 0000 ff11 12e9 c0a8 0002  E..E&...........
	0x0010:  c0a8 007f dd7c dd7c 0031 1761 2900 0014  .....|.|.1.a)...
	0x0020:  7473 7572 d073 d572 b4f1 0000 4c49 4658  tsur.s.r....LIFX
	0x0030:  5632 0000 9835 1be3 bc23 0300 0300 0000  V2...5...#......
	0x0040:  017c dd00 00                             .|...
23:48:50.780351 IP 192.168.0.62.56700 > 192.168.0.127.56700: UDP, length 41
	0x0000:  4500 0045 0488 0000 ff11 3512 c0a8 003e  E..E......5....>
	0x0010:  c0a8 007f dd7c dd7c 0031 347c 2900 0014  .....|.|.14|)...
	0x0020:  7473 7572 d073 d56b a201 0000 4c49 4658  tsur.s.k....LIFX
	0x0030:  5632 0000 c04b 9f8b 0505 0000 0300 0000  V2...K..........
	0x0040:  057c dd00 00                             .|...
23:48:50.780569 IP 192.168.0.61.56700 > 192.168.0.127.56700: UDP, length 41
	0x0000:  4500 0045 0494 0000 ff11 3507 c0a8 003d  E..E......5....=
	0x0010:  c0a8 007f dd7c dd7c 0031 14df 2900 0014  .....|.|.1..)...
	0x0020:  7473 7572 d073 d56b 4715 0000 4c49 4658  tsur.s.kG...LIFX
	0x0030:  5632 0000 98d2 418f 0505 0000 0300 0000  V2....A.........
	0x0040:  057c dd00 00                             .|...
```

So it doesn't seem to be a firewall/routing error, and the bulbs are definitely responding. At this point, I figured I'd hand it off to you if you're interested!

**Comment by samclane** [comment]
Thanks for the feedback!

I've added a network debug logger to [0.0.19](https://github.com/samclane/mantle/releases/tag/0.0.19). You can enable it in settings. It should create a new folder next to your executable called `/log`, and inside should be a file called `network.ndjson`. Let the program run for ~30 seconds, then upload that file here.

**Comment by JakeHPark** [comment]
Here you go!

[network.ndjson.txt](https://github.com/user-attachments/files/28185536/network.ndjson.txt)

**Comment by samclane** [comment]
@JakeHPark Could you try the following:

Add to NixOS configuration and rebuild:

`networking.firewall.allowedUDPPorts = [ 56700 ];`

Or, for the equivalent per-interface form:

`networking.firewall.interfaces.enp37s0.allowedUDPPorts = [ 56700 ];`

Then `sudo nixos-rebuild switch` and re-run mantle.

**Comment by JakeHPark** [comment]
Crap, this is embarrassing; I thought I'd checked the firewall already. Sorry for wasting your time! :P
